{
  "resource_id": "C-026",
  "name": "身心障礙者生活補助費",
  "provider": "衛生福利部（辦法）；戶籍所在地直轄市、縣（市）政府核發",
  "level": "中央",
  "regions": [
    "全國"
  ],
  "need_categories": [
    "生活/急難救助",
    "醫療/健康"
  ],
  "service_content": "依法領有身心障礙者手冊或身心障礙證明，並具下列資格者，得請領身心障礙者生活補助費（以下簡稱生活補助費）：",
  "eligibility": [
    {
      "condition_id": "C026-1",
      "value": "已摘錄",
      "source_excerpt": "依法領有身心障礙者手冊或身心障礙證明",
      "source_locator": "第2條",
      "required_input": "身心障礙證明或手冊",
      "data_source": "社政機關",
      "judgment_method": "核對持有",
      "manual_confirm_point": "—"
    },
    {
      "condition_id": "C026-2",
      "value": "已摘錄",
      "source_excerpt": "實際居住於戶籍所在地之直轄市、縣（市）。",
      "source_locator": "第2條第1項第1款",
      "required_input": "居住地與戶籍地",
      "data_source": "戶政",
      "judgment_method": "比對",
      "manual_confirm_point": "—"
    },
    {
      "condition_id": "C026-3",
      "value": "已摘錄",
      "source_excerpt": "最近一年居住國內超過一百八十三日。",
      "source_locator": "第2條第1項第2款",
      "required_input": "居住國內日數",
      "data_source": "入出境紀錄",
      "judgment_method": "計算",
      "manual_confirm_point": "—"
    },
    {
      "condition_id": "C026-4",
      "value": "已摘錄",
      "source_excerpt": "未經政府補助收容安置於機構夜間式或全日住宿式服務。",
      "source_locator": "第2條第1項第3款",
      "required_input": "安置狀況",
      "data_source": "社政",
      "judgment_method": "比對",
      "manual_confirm_point": "—"
    },
    {
      "condition_id": "C026-5",
      "value": "已摘錄",
      "source_excerpt": "低收入戶。",
      "source_locator": "第2條第1項第4款第1目",
      "required_input": "低收入戶身分",
      "data_source": "社政",
      "judgment_method": "比對",
      "manual_confirm_point": "—"
    },
    {
      "condition_id": "C026-6",
      "value": "已摘錄",
      "source_excerpt": "家庭總收入平均分配全家人口之金額，未達當年度每人每月最低生活費二點五倍，且未超過臺灣地區平均每人每月消費支出一點五倍。",
      "source_locator": "第2條第1項第4款第3目之1",
      "required_input": "家庭總收入、人口數",
      "data_source": "財稅資料",
      "judgment_method": "對照當年度標準",
      "manual_confirm_point": "當年度最低生活費金額來源未載明"
    },
    {
      "condition_id": "C026-7",
      "value": "已摘錄",
      "source_excerpt": "家庭總收入應計算人口之所有存款本金及有價證券價值合計未超過一人時為新臺幣二百萬元，每增加一人，增加新臺幣二十五萬元。",
      "source_locator": "第2條第1項第4款第3目之2",
      "required_input": "存款本金、有價證券",
      "data_source": "財稅資料",
      "judgment_method": "計算",
      "manual_confirm_point": "—"
    }
  ],
  "exclusions_cumulation": [
    {
      "value": "已摘錄",
      "source_excerpt": "同時符合申請第一項生活補助費及政府所提供其他生活補助或生活津貼要件者，僅能擇一領取。但低收入戶生活扶助及榮民就養金，不在此限。",
      "source_locator": "第2條第3項"
    }
  ],
  "household_calculation_basis": {
    "value": "已摘錄",
    "source_excerpt": "本辦法所定家庭總收入之應計算人口範圍及計算方式，依社會救助法相關規定辦理。",
    "source_locator": "第14條"
  },
  "validity_period": "未知（辦法自101年7月11日施行；金額每四年得調整一次，第3條第2項）",
  "application_deadline": "未知（直轄市、縣（市）政府每年定期辦理資格重新調查，第10條）",
  "documents": [
    "申請表",
    "國民身分證正本；十四歲以下者得檢附戶口名簿",
    "前二款以外之其他必要證明文件"
  ],
  "application_method": "向戶籍所在地之直轄市、縣（市）主管機關提出申請（第5條）",
  "contact": "未知",
  "source_url": "https://law.moj.gov.tw/LawClass/LawAll.aspx?pcode=D0050189",
  "source_published_date": "2019-12-27",
  "last_checked_date": "2026-10-18",
  "checked_by": "Claude Sonnet 5.5 (桌面蒐集，非人工現場查核)",
  "version": "v1-2026-10-18",
  "status": "候選",
  "capacity_confirmation": "未確認",
  "uncertainty_notes": [
    "資料取自全國法規資料庫頁面文字，僅代表蒐集當日版本；法規可能再修正，須人工比對主管機關公布版本。",
    "每月核發金額（第3條，如低收入戶重度以上每月8,200元）依2012年起每四年調整，頁面金額可能已過時，故未列入摘錄，須查衛福部最新公告。",
    "最後修正民國108年，須人工確認後續是否修正。",
    "中低收入戶（第4款第2目）及不動產限額條件未逐條摘錄。"
  ]
}