{
  "resource_id": "C-016",
  "name": "學校辦理午餐補助（山地、偏遠、離島國立高級中等以下學校經濟需要協助學生午餐費）",
  "provider": "教育部（學校設置廚房及辦理午餐補助辦法）",
  "level": "中央",
  "regions": [
    "山地、偏遠及離島地區之國立高級中等以下學校"
  ],
  "need_categories": [
    "兒少/就學",
    "食物/物資"
  ],
  "service_content": "對低收入戶、中低收入戶、家庭突發因素及經導師家庭訪視認定父母非自願性失業一個月以上、無薪休假、任一方身心障礙或其他經濟上需要協助學生，補助午餐費；每名學生午餐每餐，按學校收費基準全額補助，以全年上課日二百日計算。",
  "eligibility": [
    {
      "condition_id": "C016-1",
      "value": "已摘錄",
      "source_excerpt": "辦理午餐：位於山地、偏遠及離島地區之國立高級中等以下學校。",
      "source_locator": "第2條第1項第2款",
      "required_input": "學生就讀學校名稱與所在地",
      "data_source": "學校",
      "judgment_method": "確認為位於山地、偏遠及離島地區之國立高級中等以下學校",
      "manual_confirm_point": "地方政府主管之國中小是否有其他午餐補助，本來源未載明，須另查"
    },
    {
      "condition_id": "C016-2",
      "value": "已摘錄",
      "source_excerpt": "對低收入戶、中低收入戶、家庭突發因素及經導師家庭訪視認定父母非自願性失業一個月以上、無薪休假、任一方身心障礙或其他經濟上需要協助學生，補助午餐費",
      "source_locator": "第3條第2款",
      "required_input": "學生是否屬低收入戶／中低收入戶；家庭突發狀況或父母失業等",
      "data_source": "學校導師訪視；證明文件",
      "judgment_method": "比對是否屬所列情形之一",
      "manual_confirm_point": "「經濟上需要協助」之認定標準來源未載明，由學校認定"
    }
  ],
  "exclusions_cumulation": [
    {
      "value": "已摘錄",
      "source_excerpt": "學校已就供應午餐領有政府機關相關補助者，不得依本辦法重複申請相關補助。",
      "source_locator": "第4條第3項"
    },
    {
      "value": "已摘錄",
      "source_excerpt": "學生已領有與補助午餐費性質相當之給付者，學校不得重複申請本辦法之補助。",
      "source_locator": "第4條第4項"
    }
  ],
  "household_calculation_basis": {
    "value": "未知",
    "source_excerpt": "",
    "source_locator": ""
  },
  "validity_period": "未知（辦法自發布日施行；修正條文自一百十四年二月一日施行）",
  "application_deadline": "未知",
  "documents": [
    "未知（本辦法由學校向教育部提出申請，學生如何向學校申請，來源未載明）"
  ],
  "application_method": "由學校填具申請書並擬具計畫書向教育部提出（學生端申請方式未載明）",
  "contact": "未知",
  "source_url": "https://law.moj.gov.tw/LawClass/LawAll.aspx?pcode=H0070061",
  "source_published_date": "2024-08-30",
  "last_checked_date": "2026-10-18",
  "checked_by": "Claude Sonnet 5.5 (桌面蒐集，非人工現場查核)",
  "version": "v1-2026-10-18",
  "status": "暫停",
  "capacity_confirmation": "未確認",
  "uncertainty_notes": [
    "暫停／不適用於家庭層級推薦：本辦法補助對象為「學校」（學校申請、補助午餐費），學生與家庭無直接申請權；僅供參考，不得列入對家庭的正式推薦。保留此檔只為記錄查核結果。",
    "資料取自全國法規資料庫頁面文字，僅代表蒐集當日版本；法規可能再修正，須人工比對主管機關公布版本。",
    "適用範圍僅限第2條第1項第2款所列山地、偏遠及離島地區之國立高級中等以下學校，非全國性學生午餐補助；regions 已據此縮限。原條款定位（第4條第2、3項）有誤，已更正為第4條第3項（學校已領補助）、第4條第4項（學生已領性質相當給付）；後者由資格欄移至排除欄。",
    "本辦法為補助「學校」，學生端無直接申請規定；補助範圍僅限山地、偏遠及離島地區國立高級中等以下學校，不涵蓋一般縣市立國中小的弱勢學生午餐補助（多為地方辦理，未納入本筆）。",
    "未找到更廣的全國性國中小弱勢午餐補助教育部單一頁面，故以此辦法為近似替代；須人工另查學校衛生法及各縣市規定。",
    "家庭計算口徑、收入門檻來源未載明。"
  ]
}