{
  "resource_id": "C-018",
  "name": "學產基金急難慰問金（學生及幼兒）",
  "provider": "教育部（學產基金）",
  "level": "中央",
  "regions": [
    "全國"
  ],
  "need_categories": [
    "生活/急難救助",
    "兒少/就學"
  ],
  "service_content": "教育部（以下簡稱本部）為運用學產基金辦理學生及幼兒急難慰問金之發放，特訂定本要點。",
  "eligibility": [
    {
      "condition_id": "C018-1",
      "value": "已摘錄",
      "source_excerpt": "本要點之適用對象為在中華民國設有戶籍之國民，並就讀各級學校（包括進修學校）在學學生（以下簡稱學生）及教保服務機構在學幼兒（以下簡稱幼兒）。",
      "source_locator": "二",
      "required_input": "戶籍、就學身分",
      "data_source": "戶政、學校",
      "judgment_method": "確認設籍且在學／在園",
      "manual_confirm_point": "排除對象見下一條"
    },
    {
      "condition_id": "C018-2",
      "value": "已摘錄",
      "source_excerpt": "但不包括就讀大學校院碩士班、博士班、空中進修學院與空中大學研究所碩士班、空中大學及其附設專科部，或年齡滿二十五歲之學生。",
      "source_locator": "二",
      "required_input": "學制、年齡",
      "data_source": "學校",
      "judgment_method": "若屬所列則不適用",
      "manual_confirm_point": "—"
    },
    {
      "condition_id": "C018-3",
      "value": "已摘錄",
      "source_excerpt": "學生或幼兒發生下列事故：",
      "source_locator": "三、(一)（款首）",
      "required_input": "學生或幼兒本人所發生事故",
      "data_source": "學校、醫療證明",
      "judgment_method": "比對所列事故",
      "manual_confirm_point": "「學生或幼兒」為受慰問本人"
    },
    {
      "condition_id": "C018-4",
      "value": "已摘錄",
      "source_excerpt": "因傷病住院七日以上或發生意外死亡者，核給新臺幣（以下同）一萬元；持有全民健康保險重大傷病證明者，核給二萬元。",
      "source_locator": "三、(一)1",
      "required_input": "事故類型",
      "data_source": "醫療證明",
      "judgment_method": "比對事故",
      "manual_confirm_point": "金額以來源當日版本為準"
    },
    {
      "condition_id": "C018-5",
      "value": "已摘錄",
      "source_excerpt": "遭受父母或監護人虐待、遺棄或強迫從事不正當職業行為，並經依法設立之社會福利機構或社會福利機構委託親屬收容者，核給二萬元。",
      "source_locator": "三、(一)2",
      "required_input": "虐待、遺棄或強迫從事不正當職業之事實及收容情形",
      "data_source": "社福機構、相關證明",
      "judgment_method": "比對事故",
      "manual_confirm_point": "來源未載證明文件種類"
    },
    {
      "condition_id": "C018-6",
      "value": "已摘錄",
      "source_excerpt": "學生或幼兒之父母或監護人發生下列事故：",
      "source_locator": "三、(二)（款首）",
      "required_input": "父母或監護人所發生事故",
      "data_source": "學校、相關證明",
      "judgment_method": "比對所列事故",
      "manual_confirm_point": "以下四目之事故主體為「學生或幼兒之父母或監護人」，非學生本人"
    },
    {
      "condition_id": "C018-7",
      "value": "已摘錄",
      "source_excerpt": "失蹤達六個月以上、入獄服刑或非自願離職者，核給一萬元。",
      "source_locator": "三、(二)1",
      "required_input": "父母或監護人事故",
      "data_source": "相關證明",
      "judgment_method": "比對事故",
      "manual_confirm_point": "—"
    },
    {
      "condition_id": "C018-8",
      "value": "已摘錄",
      "source_excerpt": "２、持有全民健康保險重大傷病證明者，核給二萬元。",
      "source_locator": "三、(二)2",
      "required_input": "父母或監護人之全民健康保險重大傷病證明",
      "data_source": "健保重大傷病證明",
      "judgment_method": "比對",
      "manual_confirm_point": "此句與(一)1後半句文字相同，主體不同：本條為父母或監護人；以點次款次區分"
    },
    {
      "condition_id": "C018-9",
      "value": "已摘錄",
      "source_excerpt": "因特殊災害受傷，並住院未滿七日者，核給五千元；住院達七日以上者，核給一萬元。",
      "source_locator": "三、(二)3",
      "required_input": "父母或監護人受災受傷及住院日數",
      "data_source": "醫療證明",
      "judgment_method": "比對事故與住院日數",
      "manual_confirm_point": "「特殊災害」定義來源未載"
    },
    {
      "condition_id": "C018-10",
      "value": "已摘錄",
      "source_excerpt": "死亡者，核給二萬元。",
      "source_locator": "三、(二)4",
      "required_input": "父母或監護人死亡",
      "data_source": "戶政、死亡證明",
      "judgment_method": "比對事故",
      "manual_confirm_point": "此款主體為父母或監護人"
    },
    {
      "condition_id": "C018-11",
      "value": "已摘錄",
      "source_excerpt": "具特殊因素之急迫性個案，經本部專案核准者。",
      "source_locator": "三、(三)",
      "required_input": "特殊因素之急迫性",
      "data_source": "學校、教育部專案核准",
      "judgment_method": "教育部專案核准，不自動判斷",
      "manual_confirm_point": "須教育部專案核准"
    },
    {
      "condition_id": "C018-12",
      "value": "已摘錄",
      "source_excerpt": "發給急難慰問金之學生或幼兒，其家庭持有低收入戶或中低收入戶證明者，除核給第一項金額外，另核給一萬元。",
      "source_locator": "三、第三項",
      "required_input": "低收入戶／中低收入戶證明",
      "data_source": "社政證明",
      "judgment_method": "比對",
      "manual_confirm_point": "此為加給，非資格門檻"
    },
    {
      "condition_id": "C018-14",
      "value": "已摘錄",
      "source_excerpt": "應於事實發生之日起六個月內，向所屬學校或教保服務機構申請。",
      "source_locator": "五、(一)",
      "required_input": "事實發生日",
      "data_source": "申請人",
      "judgment_method": "計算是否在期限內",
      "manual_confirm_point": "特殊原因可專案報部"
    }
  ],
  "exclusions_cumulation": [
    {
      "value": "已摘錄",
      "source_excerpt": "申請急難慰問金者之家庭總收入，依第二項計算最近一年綜合所得總額達一百四十八萬元以上，或不動產價值合計達一千萬元以上，不予核給。",
      "source_locator": "四"
    },
    {
      "value": "已摘錄",
      "source_excerpt": "但發生意外或重大傷病之原因事實，係可歸責於學生之故意違法行為，而該學生年齡在十八歲以上者，不予核給。",
      "source_locator": "三、(一)1 但書"
    },
    {
      "value": "已摘錄",
      "source_excerpt": "依前項各款各目申請者，每年以核給一次為限。",
      "source_locator": "三、第二項"
    },
    {
      "value": "已摘錄",
      "source_excerpt": "同一家庭中之學生或幼兒以前項第二款事由為申請時，僅得核給一次。",
      "source_locator": "三、第二項"
    },
    {
      "value": "已摘錄",
      "source_excerpt": "申請人填具之申請書或檢附之文件、資料，有虛偽不實或重複申請者，本部應撤銷急難慰問金核定之處分；已核撥款項者，應以書面行政處分，通知申請人限期返還。",
      "source_locator": "六"
    }
  ],
  "household_calculation_basis": {
    "value": "已摘錄",
    "source_excerpt": "學生未婚者：與其父母或法定監護人合計。",
    "source_locator": "四、第二項第(一)款"
  },
  "validity_period": "未知",
  "application_deadline": "事實發生之日起六個月內",
  "documents": [
    "未知（來源僅稱檢具相關證明文件、資料）"
  ],
  "application_method": "向所屬學校或教保服務機構申請，由學校彙整送部審查核定",
  "contact": "未知",
  "source_url": "https://edu.law.moe.gov.tw/LawContent.aspx?id=FL035980",
  "source_published_date": "2026-07-06",
  "last_checked_date": "2026-10-18",
  "checked_by": "Claude Sonnet 5.5 (桌面蒐集，非人工現場查核)",
  "version": "v1-2026-10-18",
  "status": "候選",
  "capacity_confirmation": "未確認",
  "uncertainty_notes": [
    "原題「學產基金急難紓困助學金」未找到同名現行要點，以現行「學產基金設置急難慰問金實施要點」替代；另有「學產基金設置低收入戶學生助學金實施要點」（GL000019）。",
    "資料取自教育部主管法規共用系統頁面文字，僅代表蒐集當日版本；法規可能再修正，須人工比對主管機關公布版本。",
    "「同一家庭中之學生或幼兒以前項第二款事由為申請時，僅得核給一次」所稱「前項第二款」指三、第一項(二)（父母或監護人事故），須人工確認適用範圍。"
  ]
}