{
  "resource_id": "C-024",
  "name": "失業給付（就業保險）",
  "provider": "勞動部（勞工保險局承辦就業保險）；公立就業服務機構",
  "level": "中央",
  "regions": [
    "全國"
  ],
  "need_categories": [
    "就業",
    "生活/急難救助"
  ],
  "service_content": "失業給付按申請人離職辦理本保險退保之當月起前六個月平均月投保薪資百分之六十按月發給，最長發給六個月。但申請人離職辦理本保險退保時已年滿四十五歲或領有社政主管機關核發之身心障礙證明者，最長發給九個月。",
  "eligibility": [
    {
      "condition_id": "C024-1",
      "value": "已摘錄",
      "source_excerpt": "失業給付：被保險人於非自願離職辦理退保當日前三年內，保險年資合計滿一年以上，具有工作能力及繼續工作意願，向公立就業服務機構辦理求職登記，自求職登記之日起十四日內仍無法推介就業或安排職業訓練。",
      "source_locator": "第11條第1項第1款",
      "required_input": "投保年資、離職原因、工作能力與意願、求職登記日",
      "data_source": "勞保局年資；離職證明；公立就業服務機構",
      "judgment_method": "逐項比對",
      "manual_confirm_point": "非自願離職定義見第11條第3項"
    },
    {
      "condition_id": "C024-2",
      "value": "已摘錄",
      "source_excerpt": "本法所稱非自願離職，指被保險人因投保單位關廠、遷廠、休業、解散、破產宣告離職；或因勞動基準法第十一條、第十三條但書、第十四條及第二十條規定各款情事之一離職。",
      "source_locator": "第11條第3項",
      "required_input": "離職原因",
      "data_source": "離職證明",
      "judgment_method": "比對",
      "manual_confirm_point": "—"
    },
    {
      "condition_id": "C024-3",
      "value": "已摘錄",
      "source_excerpt": "被保險人因定期契約屆滿離職，逾一個月未能就業，且離職前一年內，契約期間合計滿六個月以上者，視為非自願離職，並準用前項之規定。",
      "source_locator": "第11條第2項",
      "required_input": "契約期間",
      "data_source": "契約",
      "judgment_method": "比對",
      "manual_confirm_point": "—"
    },
    {
      "condition_id": "C024-4",
      "value": "已摘錄",
      "source_excerpt": "被保險人於離職退保後二年內，應檢附離職或定期契約證明文件及國民身分證或其他足資證明身分之證件，親自向公立就業服務機構辦理求職登記、申請失業認定及接受就業諮詢，並填寫失業認定、失業給付申請書及給付收據。",
      "source_locator": "第25條第1項",
      "required_input": "離職日、證件",
      "data_source": "本人",
      "judgment_method": "確認期限",
      "manual_confirm_point": "—"
    },
    {
      "condition_id": "C024-5",
      "value": "已摘錄",
      "source_excerpt": "被保險人於失業期間另有工作，其每月工作收入超過基本工資者，不得請領失業給付；",
      "source_locator": "第17條第1項",
      "required_input": "失業期間工作收入",
      "data_source": "本人申報",
      "judgment_method": "對照基本工資",
      "manual_confirm_point": "基本工資金額須另查公告"
    },
    {
      "condition_id": "C024-6",
      "value": "已摘錄",
      "source_excerpt": "有受其扶養之眷屬者，每一人按申請人離職辦理本保險退保之當月起前六個月平均月投保薪資百分之十加給給付或津貼，最多計至百分之二十。",
      "source_locator": "第19-1條第1項",
      "required_input": "受扶養眷屬",
      "data_source": "戶籍、扶養證明",
      "judgment_method": "加給計算",
      "manual_confirm_point": "非資格條件，為加給"
    }
  ],
  "exclusions_cumulation": [
    {
      "value": "已摘錄",
      "source_excerpt": "領取勞工保險傷病給付、職業訓練生活津貼、臨時工作津貼、創業貸款利息補貼或其他促進就業相關津貼者，領取相關津貼期間，不得同時請領失業給付。",
      "source_locator": "第17條第2項"
    }
  ],
  "household_calculation_basis": {
    "value": "已摘錄",
    "source_excerpt": "受扶養眷屬，指受被保險人扶養之無工作收入之父母、配偶、未成年子女或身心障礙子女。",
    "source_locator": "第19-1條第2項（僅用於加給）"
  },
  "validity_period": "最長發給六個月；符合條件者最長九個月（第16條）；經濟不景氣時中央主管機關得延長（第16條第2項）",
  "application_deadline": "離職退保後二年內辦理求職登記（第25條第1項）；請求權二年間不行使而消滅（第24條）",
  "documents": [
    "離職或定期契約證明文件",
    "國民身分證或其他足資證明身分之證件",
    "失業認定、失業給付申請書及給付收據",
    "最高學歷及經歷證書影本等（公立就業服務機構得要求，第26條）"
  ],
  "application_method": "親自向公立就業服務機構辦理求職登記、申請失業認定（第25條），之後每月辦理失業再認定（第29條）",
  "contact": "未知",
  "source_url": "https://law.moj.gov.tw/LawClass/LawAll.aspx?pcode=N0050021",
  "source_published_date": "2022-01-12",
  "last_checked_date": "2026-10-18",
  "checked_by": "Claude Sonnet 5.5 (桌面蒐集，非人工現場查核)",
  "version": "v1-2026-10-18",
  "status": "候選",
  "capacity_confirmation": "未確認",
  "uncertainty_notes": [
    "資料取自全國法規資料庫頁面文字，僅代表蒐集當日版本；法規可能再修正，須人工比對主管機關公布版本。",
    "頁面修正日期為民國111年（2022-01-12），須人工確認是否更新。",
    "是否為本專案目標「低收入戶」的直接資源不明：本項取決於是否有就業保險投保年資，非以所得判斷。",
    "延長給付期間之辦法與實施期間須另查。"
  ]
}