{
  "resource_id": "C-006",
  "name": "弱勢兒童及少年生活扶助（辦法第3至5條；緊急生活扶助未取得中央原文）",
  "provider": "縣（市）主管機關辦理；中央主管機關為衛生福利部",
  "level": "中央",
  "regions": [
    "全國"
  ],
  "need_categories": [
    "生活/急難救助",
    "兒少/就學"
  ],
  "service_content": "領取生活扶助者，每人每月補助新臺幣一千九百元。",
  "eligibility": [
    {
      "condition_id": "t1",
      "value": "已摘錄",
      "source_excerpt": "一、遭遇困境之中低收入戶內兒童、少年。",
      "source_locator": "弱勢兒童及少年生活扶助與托育及醫療費用補助辦法第3條第1項第1款",
      "required_input": "中低收入戶資格（C-001）、兒少年齡、困境事實",
      "data_source": "C-001結果、社工評估",
      "judgment_method": "",
      "manual_confirm_point": "「遭遇困境」認定標準未載"
    },
    {
      "condition_id": "t2",
      "value": "已摘錄",
      "source_excerpt": "二、因懷孕或生育而遭遇困境之兒童、少年及其子女。",
      "source_locator": "弱勢兒童及少年生活扶助與托育及醫療費用補助辦法第3條第1項第2款",
      "required_input": "兒少年齡、懷孕或生育事實",
      "data_source": "醫療／戶政",
      "judgment_method": "",
      "manual_confirm_point": ""
    },
    {
      "condition_id": "t3",
      "value": "已摘錄",
      "source_excerpt": "三、其他經縣（市）主管機關評估無力撫育及無扶養義務人或撫養義務人無力維持其生活之兒童及少年。",
      "source_locator": "弱勢兒童及少年生活扶助與托育及醫療費用補助辦法第3條第1項第3款",
      "required_input": "扶養義務人狀況",
      "data_source": "社工評估",
      "judgment_method": "縣（市）主管機關評估",
      "manual_confirm_point": "評估由主管機關為之"
    },
    {
      "condition_id": "amount",
      "value": "已摘錄",
      "source_excerpt": "領取生活扶助者，每人每月補助新臺幣一千九百元。",
      "source_locator": "弱勢兒童及少年生活扶助與托育及醫療費用補助辦法第4條第1項",
      "required_input": "",
      "data_source": "",
      "judgment_method": "",
      "manual_confirm_point": "金額依第4條第2項可能經公告調整，須查最新金額"
    },
    {
      "condition_id": "t4",
      "value": "已摘錄",
      "source_excerpt": "前項補助及其審核認定與核撥事宜，由縣（市）主管機關辦理。",
      "source_locator": "弱勢兒童及少年生活扶助與托育及醫療費用補助辦法第2條第2項",
      "required_input": "戶籍所在縣市",
      "data_source": "戶政",
      "judgment_method": "確認受理機關",
      "manual_confirm_point": "直轄市另有自訂辦法，本辦法未涵蓋；本句適用生活扶助、托育及醫療費用補助，C-027 不重複摘錄"
    },
    {
      "condition_id": "emergency",
      "value": "未知",
      "source_excerpt": "",
      "source_locator": "（本來源不含緊急生活扶助）",
      "required_input": "兒少年齡、父母失業／入獄／重大傷病等情形",
      "data_source": "",
      "judgment_method": "",
      "manual_confirm_point": "「弱勢家庭兒童及少年緊急生活扶助」之全國計畫原文本次未取得，其金額、期間與財產門檻須向衛福部社家署或縣市取得"
    }
  ],
  "exclusions_cumulation": [
    {
      "value": "已摘錄",
      "source_excerpt": "已接受政府公費安置或領取政府其他相同性質之生活類補助或津貼者，不予重複扶助；其他法令另有規定者，從優辦理；其額度低於生活扶助者，得補助其差額。",
      "source_locator": "弱勢兒童及少年生活扶助與托育及醫療費用補助辦法第5條第1項"
    }
  ],
  "household_calculation_basis": {
    "value": "未知",
    "source_excerpt": "",
    "source_locator": "生活扶助條文（第3至5條）未載家庭計算口徑；第11條第2項、第3項僅規範醫療費用補助，見 C-027"
  },
  "validity_period": "未知",
  "application_deadline": "未知（生活扶助條文未載申請期限）",
  "documents": [
    "申請表及相關證明文件（辦法第3條第2項）；清單未載"
  ],
  "application_method": "應備齊申請表及相關證明文件向戶籍所在地縣（市）主管機關申請（辦法第3條第2項）。",
  "contact": "未知（本欄所引來源未載明承辦窗口；窗口待 P1-4 人工確認）",
  "source_url": "https://law.moj.gov.tw/LawClass/LawAll.aspx?pcode=D0050180",
  "source_published_date": "2026-01-07",
  "last_checked_date": "2026-10-18",
  "checked_by": "Claude Sonnet 5.5 (桌面蒐集，非人工現場查核)",
  "version": "v1-2026-10-18",
  "status": "候選",
  "capacity_confirmation": "未確認",
  "uncertainty_notes": [
    "範圍界定：本檔僅涵蓋辦法第3至5條之生活扶助。托育費用補助（第6至8條）與醫療費用補助（第9至13條）及共通不予補助規定（第14條）見 C-027；未滿2歲準公共托育見 C-013。三檔摘錄不重複。",
    "辦法條文所稱「縣（市）主管機關」，直轄市是否另有規定未確認。",
    "使用者所列「緊急生活扶助」未取得官方中央原文（僅見地方版本與搜尋摘要，未採用），故本檔僅涵蓋辦法所定生活扶助。",
    "第4條金額自105年起依物價指數調整，條文所載數額可能已不是現行額。",
    "本檔為桌面蒐集之候選資料，非人工現場查核；法規頁面可能已修正，使用前須重新比對來源。",
    "與 C-027 同屬「弱勢兒童及少年生活扶助與托育及醫療費用補助辦法」：本檔僅第3–5條（生活扶助，每人每月定額），C-027 為第6–14條（托育、醫療費用補助）。兩者為同一辦法下不同給付，資格與金額不同；若覆核者認定應視為單一方案，可合併為一檔。"
  ]
}